,Name,Rating,Reviews,Category,Location,Contact Number,Website,Description,Meta
37,Bargain Rental Cars - Christchurch Airport,4.6,154,Car rental agency,"Christchurch, New Zealand",+64 3 358 9342,https://www.bargainrentalcars.co.nz/,"""When you rent a vehicle from Bargain Rental Cars, you are supporting a 100% New Zealand owned and operated.

You will always be provided with a personal service that ensures you get a rental vehicle that is not only a pleasure to drive, but gives you value for money.

We have been operating for the past 20 years and have built a great reputation for an incredible service and a quality fleet of rental cars, rental vans and other rental vehicles.

We offer you a full range of rental vehicles, including:
- Rental cars (small cars, sedans, hatchbacks, hybrids and more)
- Rental minivans and minibuses

We have 2 branches in Christchurch: City (Hornby) and Airport""","4.6
(154) · Car rental agency"
38,New Zealand Rent A Car - Car Rental North Shore,4.4,19,Car rental agency,"Auckland, New Zealand",+64 9 827 7620,https://www.nzrentacar.co.nz/auckland-north-shore.html?utm_source=google&utm_medium=organic&utm_campaign=gmb_akl_north_shore,"""Rent a moving truck, cargo van, minibus, car, SUV, or trailer from AVR, Cnr 191 Bush Road & Volkner Place Albany.
Call us on 09 8277 620 or email admin@vehiclerentals.co.nz

We would love to hear from you and spread the word, leave us a google review

Look forward to seeing you soon""","4.4
(19) · Car rental agency"
39,New Zealand Rent A Car - Auckland Vehicle Rentals,4.1,14,Car rental agency,"Auckland, New Zealand",+64 9 827 7620,https://www.nzrentacar.co.nz/locations/auckland-central/,"""G’day and welcome to the Auckland central branch of New Zealand Rent A Car, Auckland Central and North Shore, where we provide our customers with quality Auckland rental cars at affordable rates. As an independently owned and operated car hire company customer satisfaction is of the utmost importance to us, in fact we operate a 24 hour call service where you can leave a message out of hours, and be certain you will speak to a real person within working hours.
We hire cars, minibuses, trucks and cargo vans.
Please note we are an agent only of NZ Rent a Car New Zealand, and not aligned with other locations.""","4.1
(14) · Car rental agency"
40,Bargain Rental Cars - Hamilton,4.6,113,Car rental agency,"Hamilton, New Zealand",+64 7 974 0890,https://www.bargainrentalcars.co.nz/,"""When you rent a vehicle from Bargain Rental Cars - Hamilton, you are supporting a family business 100% New Zealand owned and operated for over 20 years.

You will always be provided with a personal service that ensures you get a rental vehicle that is not only a pleasure to drive, but gives you value for money.

Services we provide: Car rental, van rental, minivan rental & people mover rental

If you are looking for a car rental agency in Hamilton, look no further. Bargain Rental Cars has the friendliest service in town and maybe the best prices too.

Call us today on 07-974 0890 or book online

Remember, for cheap and reliable rental cars in Hamilton, think Bargain Rental Cars""","4.6
(113) · Car rental agency"
41,Bargain Rental Cars - Wellington City,4.4,160,Car rental agency,"Wellington, New Zealand",+64 4 384 0134,https://www.bargainrentalcars.co.nz/,"""When you rent a vehicle from Bargain Rental Cars - Wellington City, you are supporting a family business 100% New Zealand owned and operated for over 20 years.

You will always be provided with a personal service that ensures you get a rental vehicle that is not only a pleasure to drive, but gives you value for money.

Services we provide: Car rental, van rental, minivan rental & people mover rental

If you are looking for a car rental agency in Wellington City, look no further. Bargain Rental Cars has the friendliest service in town and maybe the best prices too.

Call us today on 04-384 0134 or book online

Remember, for cheap and reliable rental cars in Wellington City, think Bargain Rental Cars""","4.4
(160) · Car rental agency"
42,Bargain Rental Cars - Wellington Airport (Depot),4.9,107,Car rental agency,"Wellington, New Zealand",+64 4 384 0134,https://www.bargainrentalcars.co.nz/,"""When you rent a vehicle from Bargain Rental Cars in Wellington, you are supporting a family business 100% New Zealand owned and operated for over 20 years.

You will always be provided with a personal service that ensures you get a rental vehicle that is not only a pleasure to drive, but gives you value for money.

Services we provide: Car rental, van rental, minivan rental & people mover rental

If you are looking for a car rental agency in Wellington Airport, look no further. Bargain Rental Cars has the friendliest service in town and maybe the best prices too.

Call us today on 04-384 0134 or book online

Remember, for cheap and reliable rental cars in Wellington Airport think Bargain Rental Cars""","4.9
(107) · Car rental agency"
43,Enterprise Rent-A-Car - Christchurch Airport,4.5,146,Car rental agency,"Christchurch, New Zealand",+64 9 870 3330,https://www.enterpriserentacar.co.nz/en/car-rental/locations/new-zealand/christchurch-international-airport-kze4.html?mcid=yext:245709&utm_source=google&utm_medium=organic&utm_campaign=local&utm_id=CHCT,"""Enterprise Rent-A-Car in Christchurch Airport is one of eight Enterprise Rent-A-Car branches in New Zealand. And is part of a network of over 9,500 branches and 90 countries worldwide. Join the largest network of rental cars, with vehicles across multiple ranges, including: SUVs, hybrids and trucks. All at an affordable price. We offer one-way rentals, where you can pick up your car in one location and drop it off at another Enterprise Rent-A-Car New Zealand branch. As well as business rentals. Our customer service team is happy to answer any of your questions, and we hope to see you soon.""","4.5
(146) · Car rental agency"
44,Snap Rentals,4.3,N/A,Car rental agency,"Auckland, New Zealand",+64 9 275 2438,https://www.snaprentals.co.nz/?utm_source=google&utm_medium=organic&utm_campaign=gmb-akld-airport,"""Welcome to Snap Auckland Airport!
We understand that renting a car can often feel like a daunting task, which is why we're here to simplify it all. Our mission? Revolutionise the car rental industry and redefine your travel experience
Gone are the days of complicated processes and confusing corporate jargon. We're all about transparency and putting you, the customer, first. Say goodbye to the hassle – we're here to make car rental easier than ever before.

With locations spanning Auckland CBD, Auckland Airport, Christchurch Airport, and Queenstown your rental is never out of reach.
Ready to embark on a simply better car rental journey?
Book now and let your NZ adventure start here.""","4.3
(1.1K) · Car rental agency"
45,New Zealand Discount Car Rentals,4.2,43,Car rental agency,"Queenstown, New Zealand",+64 3 974 3819,http://www.nzdcr.co.nz/,N/A,"4.2
(43) · Car rental agency"
46,Snap Rentals,4.4,928,Car rental agency,"Christchurch, New Zealand",+64 800 288 699,https://www.snaprentals.co.nz/?utm_source=google&utm_medium=organic&utm_campaign=gmb-chch,"""Welcome to Snap Christchurch Airport!
We understand that renting a car can often feel like a daunting task, which is why we're here to simplify it all. Our mission? Revolutionise the car rental industry and redefine your travel experience
Gone are the days of complicated processes and confusing corporate jargon. We're all about transparency and putting you, the customer, first. Say goodbye to the hassle – we're here to make car rental easier than ever before.

With locations spanning Auckland CBD, Auckland Airport, Christchurch Airport, and Queenstown your rental is never out of reach.
Ready to embark on a simply better car rental journey?
Book now and let your NZ adventure start here.""","4.4
(928) · Car rental agency"
47,Luxury Rentals NZ Limited,4.6,36,Car rental agency,"Auckland, New Zealand",+64 22 135 7227,https://www.luxuryrentalsnz.com/,"""Personalised service
We are a small NZ-owned company and pride ourselves on providing a high standard of personalised customer service.

Tailored solutions
We understand that everyone’s needs are unique. Our flexible approach and personalised service means we can tailor a solution that works for you.

Affordable luxury
We believe luxury should be enjoyed, and therefore, affordable. Our reasonable pricing reflects this philosophy.

Cars for every occasion
We know different occasions call for different types of vehicle. Our fleet includes a variety of luxury vehicles for every occasion.""","4.6
(36) · Car rental agency"
48,Anzed Rentals,4.8,46,Car rental agency,"Christchurch, New Zealand",+64 210 473 508,http://www.anzed.co.nz/,"""Your Local in Christchurch New Zealand. Personal service from the owner, from a personal greeting at the airport till you are delivered safely again at the end of you visit it is my privilege to be at your service. Anzed is not your usual cookie cutter Rental company, As customers have often said to me, it will be a very different experience than you have ever had before.""","4.8
(46) · Car rental agency"
49,Apex Car Rentals Wellington City,4.4,154,Car rental agency,"Wellington, New Zealand",+64 4 385 2163,https://www.apexrentals.co.nz/rental-car-locations/wellington-city-branch,"""Apex Car Rentals Wellington City is centrally located in downtown Wellington, within easy walking distance of Te Papa Museum and the waterfront.

Book online and choose from a wide selection of rental vehicles including small economy cars, mid-sized and full sized sedans, station wagons, 4WD's, and people movers.

We pride ourselves on delivering exceptional service and respecting the cultural diversity of our customers.

Try Apex Wellington City for your next car hire and discover why our customers rate us the best car rental company in New Zealand.""","4.4
(154) · Car rental agency"
50,James Blond Rentals,4.6,824,Car rental agency,"Auckland, New Zealand",+64 800 525 663,http://www.jamesblond.co.nz/,"""'James Blond Rentals' is a well trusted name when it comes to car and truck rental company in Auckland. We've been serving New Zealanders, and customers from around the world for over 20 years. Our single aim is to give you the very best Travelling or Moving experience possible. We specialize in rental cars, trucks, cargo vans, minivans, and trailers. We are based in Glen Eden, Auckland, and also provide 24 hours rental car service from Auckland Airport. With a diverse fleet of vehicles, including hatchbacks, SUV, station wagons and sedans, 7 seater SUV, 8, 10 & 12 minivans, 19 seater bus, box trucks, flat decks, Utes, Cargo vans, trailers, and we have a vehicle for every purpose and for everyone.""","4.6
(824) · Car rental agency"
51,Mint Car Rentals - Car hire Auckland Airport,4.5,82,Car rental agency,"Auckland, New Zealand",+64 800 842 424,http://www.mintrentals.co.nz/,"""Located a few minutes from the Auckland airport terminals, our Auckland Airport car rental service offers a hassle-free start to your New Zealand adventure. Choose from an extensive range of vehicles, including eco-friendly hybrid hatchback or sedan, 4x4 Station wagon for the extra boot space and if you’re travelling with friends and family you can hire our 8 seaters. With our easy online booking system, secure payment options, and flexible rental terms, Mint Auckland car rental is here to assist. We want you to explore our beautiful Aotearoa in your own comfort. We keep our prices low and competitive so you can see more , for less. Book your Auckland airport car rental experience with Mint Car rentals today !!""","4.5
(82) · Car rental agency"
52,Orange Rentals - Christchurch Airport Rental Cars New Zealand,4.3,40,Car rental agency,"Christchurch, New Zealand",+64 3 961 5880,http://www.orangerentals.co.nz/,N/A,"4.3
(40) · Car rental agency"
53,Pegasus Rental Cars Wanganui,4.8,87,Car rental agency,"Whanganui, New Zealand",+64 6 345 0088,https://www.rentalcars.co.nz/pegasus-locations/whanganui/,N/A,"4.8
(87) · Car rental agency"
54,A Rentals NZ Ltd,4.9,74,Car rental agency,"Auckland, New Zealand",+64 9 600 6660,http://www.arentalscar.com/,"""Rental Cars Company provide service NewZealand Wide

Auckalnd: 27 Aintree Ave Mangere

Christchuch: 153 Orchard Road Harewood

Queenstown: 77 Glenda Drive Frankton

Provide different range of Vehicle

Small Cars

4WD SUV

Luxury Van 7-8 Seats

MINI Van 12 Seats

Medium Bus 20-20 Seats""","4.9
(74) · Car rental agency"
55,EZU Car Rental,4.2,369,Car rental agency,"Christchurch, New Zealand",+64 210 438 288,http://www.ezucarrental.com/,"""EZU Car Rental - The Perfect Car for Your Journey

Discover the perfect car for your journey at EZU Car Rental. We offer a wide range of top-quality vehicles to suit all your travel needs. Our friendly and knowledgeable staff is dedicated to providing exceptional customer service, ensuring a hassle-free rental experience from start to finish.

In addition to our regular operating hours, we also offer after-hours car pick-up for your convenience. Please note that an After-Hours Fee applies for this service.

Choose EZU Car Rental for a stress-free and memorable journey. Contact us today to find the perfect car for your next adventure.""","4.2
(369) · Car rental agency"
56,Hertz Christchurch Downtown,4.5,30,Car rental agency,"Christchurch, New Zealand",+64 3 365 2195,https://www.hertz.com.au/rentacar/location/newzealand/christchurch/CHCC60?utm_campaign=gmb-Hertz-Car-Rental---Christchurch-Downtown&utm_medium=gmb-websitelink&utm_source=Google,"""Hertz is a leader in the car rental industry with a 100-year history and many firsts and excellence in the areas of service, innovation, selection and safety. Operating in over 50 locations in New Zealand, Hertz has a diverse and modern fleet to meet all its customers’ business and leisure travel needs and can offer an extraordinary driving experience in comfort and style""","4.5
(30) · Car rental agency"
57,Europcar Wellington Airport,4.4,229,Car rental agency,"Wellington, New Zealand",+64 4 380 6617,https://www.europcar.co.nz/en-nz/stations/new-zealand/wellington-airport?utm_campaign=WLGT01&utm_medium=organic&utm_source=local,"""Welcome to Europcar Wellington car rental agency! Friendly service, new cars and competitive prices are part of our daily offer. Whether you want to rent a car for business or pleasure, whether you need a car (city, family or luxury car), a van or or a truck, Europcar has the rental vehicle for you. Car and van rental is simplified with Europcar’s online booking on our website or app. Collecting and dropping off your vehicle has never been easier. Enjoy your ride!""","4.4
(229) · Car rental agency"
58,GO Rentals - Nelson Airport,5.0,92,Car rental agency,"Nelson, New Zealand",+64 9 974 1598,https://www.gorentals.co.nz/rental-car-locations/nelson/?utm_source=Google_Maps&utm_medium=organic&utm_campaign=Google_Maps-Free_Listing_NEL&utm_content=NelsonAirport,"""As one of New Zealand’s largest independent Kiwi car rental companies, we’re thrilled to offer our award-winning services with your Nelson car hire.

Our Nelson Airport car rental branch is conveniently located right outside the airport terminal. We're the first booth in the car rental kiosk building.
Cruise through stunning landscapes with our modern fleet, featuring everything from eco-friendly EVs including the Tesla Model 3 and Hybrids to spacious SUVs, all at affordable prices.
We'll take care of the important stuff and point out the fun stuff you can do while on the road, freeing you up to enjoy the journey. GO love every moment with the perfect car rental in Nelson.""","5.0
(92) · Car rental agency"
59,Bargain Rental Cars - Henderson,4.7,53,Car rental agency,"Auckland, New Zealand",+64 9 941 4110,https://www.bargainrentalcars.co.nz/,"""When you rent a vehicle from Bargain Rental Cars - Henderson, you are supporting a family business 100% New Zealand owned and operated for over 20 years.

You will always be provided with a personal service that ensures you get a rental vehicle that is not only a pleasure to drive, but gives you value for money.

Services we provide: Car rental, van rental, minivan rental & people mover rental

If you are looking for a car rental agency in Henderson, look no further. Bargain Rental Cars has the friendliest service in town and maybe the best prices too.

Call us today on 09-941 4110 or book online

Remember, for cheap and reliable rental cars in Henderson & West Auckland, think Bargain Rental Cars""","4.7
(53) · Car rental agency"
60,"Rite Price Rentals (Tauranga & Port) - Car, Van & Truck Rentals",4.9,351,Car rental agency,"Tauranga, New Zealand",+64 7 575 2726,https://www.ritepricerentals.co.nz/,"""Affordable & Reliable Rental Vehicles in Tauranga

Book your rental car or van in Tauranga from one of our two friendly and convenient branches (Tauranga City & Airport). Rite Price Rentals offers a wide variety of rental cars and vans to suit every budget. The Team and Rite Price Rentals will always go the extra mile to ensure you have the best possible experience.""","4.9
(351) · Car rental agency"
61,Apex Car Rentals Christchurch City,4.3,159,Car rental agency,"Christchurch, New Zealand",+64 3 363 3001,https://www.apexrentals.co.nz/rental-car-locations/christchurch-city-branch,"""Choose Apex Car Rentals Christchurch City for your next car hire and discover why our customers rate us the best car hire company in New Zealand. Apex consistently receives 5-stars for the booking process, transperancy of costs and fees, vehicle availablity, value for money, customer service and overall satisfaction.""","4.3
(159) · Car rental agency"
62,Yes Rentals Christchurch Branch,4.5,185,Car rental agency,"Christchurch, New Zealand",+64 3 420 2878,http://www.yesrentals.co.nz/,"""Welcome to our young and vibrant car rental company in New Zealand!
At our company, we understand that renting a car is more than just a transaction, it's an experience. That's why we go the extra mile to provide exceptional customer service and make sure that every customer has a stress-free and enjoyable rental experience.

If wanting to discover the stunning landscapes of New Zealand, we have a wide range of vehicles to suit your needs and budget. Renting a car has never been easier with our easy online booking system and flexible rental options.

So why wait? Book your next car rental with us and let us help you make the most of your time in New Zealand!""","4.5
(185) · Car rental agency"
63,Enterprise Rent-A-Car - Queenstown Airport,3.8,131,Car rental agency,"Queenstown, New Zealand",+64 9 870 3330,https://www.enterpriserentacar.co.nz/en/car-rental/locations/new-zealand/queenstown-airport-kze2.html?mcid=yext:245709&utm_source=google&utm_medium=organic&utm_campaign=local&utm_id=ZQNT,"""Enterprise Rent-A-Car in Queenstown is one of eight branches in New Zealand. This branch, along with another in Queenstown, is part of a global network of over 9,500 locations across 90 countries. Choose the best car rental in Queenstown, with a wide range of vehicles, including 4WDs, hybrids, and more, all at an affordable price. We offer one-way rentals, allowing you to pick up your rental car in Queenstown and drop it off at another Enterprise Rent-A-Car New Zealand branch. Our generous Business Car Rental program and friendly team are here to assist you with any questions. For the best car hire in Queenstown, including car rental at Queenstown Airport, choose Enterprise Rent-A-Car. We hope to see you soon!""","3.8
(131) · Car rental agency"
64,Hertz Car Rental Wellington,4.1,94,Car rental agency,"Wellington, New Zealand",+64 4 384 3809,https://www.hertz.co.nz/p/car-rentals/new-zealand/wellington/wellington-downtown?utm_source=google&utm_medium=local&utm_campaign=gmb_listing&utm_content=wellington%20downtown,N/A,"4.1
(94) · Car rental agency"
65,Avis Car and Truck Rental Auckland City,3.9,92,Car rental agency,"Auckland, New Zealand",+64 9 379 2650,https://www.avis.co.nz/en/locations/nz/auckland/ai1?utm_source=GMB&utm_medium=organic&utm_campaign=Auckland-Downtown,"""Discover the range of car rentals available in Auckland City city with Avis. Our Auckland City branch offers small and medium cars for a busy day in city, luxurious premium models for the corporate traveller and SUVs or 4WDs that would make the perfect accompaniment for a family holiday. Plus Avis also offers electric car rentals, and a full range of utes, vans, and moving trucks for various commercial needs. Choose Avis for great service and best value truck and car hire in Auckland City.""","3.9
(92) · Car rental agency"
66,Ace Rental Cars Auckland City - Victoria Street West,3.8,133,Car rental agency,"Auckland, New Zealand",+64 800 502 277,https://www.acerentalcars.co.nz/locations/auckland-city/?utm_source=google&utm_medium=local&utm_campaign=gmb_listing&utm_content=auckland_city_Vic,"""We are an established deep-value car rental company and have been around for 30 years. Founded in 1987 in Auckland, New Zealand, we identified the consumer need for a budget-focused rental car company.

We now operate seventeen branches across fifteen cities throughout Australia and New Zealand. In addition to the core fleet of older vehicles, the company also provides a Premium fleet, featuring brand new vehicles with creature comforts at an attractive price.

We stick to our mission of providing the best value in rentals in Australia and New Zealand
Our focus on simplicity is underpinned by our values: friendly, confident, reliable, and straightforward.

We’re straight-talking and down to earth, so book your next rental car with us.""","3.8
(133) · Car rental agency"
67,Enterprise Rent-A-Car - Auckland City,4.7,7,Car rental agency,"Auckland, New Zealand",+64 9 870 3330,https://www.enterpriserentacar.co.nz/en/car-rental/locations/new-zealand/auckland-city-kze7.html?mcid=yext:245709&utm_source=google&utm_medium=organic&utm_campaign=local&utm_id=AKLC,"""Enterprise Rent-A-Car in Auckland City is one of eight Enterprise Rent-A-Car branches in New Zealand. This is one of two branches in Auckland, the other being at the airport. It's also part of a network of over 9,500 branches and 90 countries worldwide. Choose the best car hire in Auckland City, with vehicles across multiple ranges, including 4WDs, hybrids and more. All at an affordable price! We offer one-way rentals, allowing you to pick up your car in one location and drop it off at another Enterprise Rent-A-Car New Zealand branch. We also have a generous Business Car Rental program. Our friendly team is happy to answer any of your questions. We hope to see you soon!""","4.7
(7) · Car rental agency"
68,Hitch Car Rentals,4.2,543,Car rental agency,"Auckland, New Zealand",+64 9 256 0546,https://www.snaprentals.co.nz/hitch-car-rentals,N/A,"4.2
(543) · Car rental agency"
69,Apex Car Rentals Wellington Airport,4.5,171,Car rental agency,"Wellington, New Zealand",+64 4 388 6581,https://www.apexrentals.co.nz/rental-car-locations/wellington-airport-branch,"""Apex Car Rentals Wellington Airport is located 2 minutes from the terminal building and we provide a free shuttle service to our location.

Book online and choose from a wide selection of rental vehicles including small economy cars, mid-sized and full sized sedans, station wagons, 4WD's, and people movers.

We pride ourselves on delivering exceptional service and respecting the cultural diversity of our customers.

Try Apex Wellington Airport for your next car hire and discover why our customers rate us the best car rental company in New Zealand.""","4.5
(171) · Car rental agency"
70,VIPHIRE CAR RENTAL 新西兰华人租车公司,4.5,37,Car rental agency,"Auckland, New Zealand",+64 800 847 888,https://www.viphire.co.nz/,N/A,"4.5
(37) · Car rental agency"
71,Bargain Rental Cars - Onehunga,4.8,70,Car rental agency,"Auckland, New Zealand",+64 9 636 5224,https://www.bargainrentalcars.co.nz/,"""When you rent a vehicle from Bargain Rental Cars - Onehunga, you are supporting a family business 100% New Zealand owned and operated for over 20 years.

You will always be provided with a personal service that ensures you get a rental vehicle that is not only a pleasure to drive, but gives you value for money.

Services we provide: Car rental, van rental, minivan rental & people mover rental

If you are looking for a car rental agency in Onehunga and surround areas, look no further. Bargain Rental Cars has the friendliest service in town and maybe the best prices too.

Call us today on 09-636 5224 or book online

Remember, for cheap and reliable rental cars in Onehunga, think Bargain Rental Cars""","4.8
(70) · Car rental agency"
72,RaD Car Hire Taupo,4.7,142,Car rental agency,"Taupō, New Zealand",+64 7 378 2740,https://www.radcarhire.co.nz/branches/car-rental-taupo?utm_source=google+&utm_medium=organic&utm_campaign=gmb&utm_content=taupo,"""We are a locally owned Taupo rental car company with a branch at the Taupo Airport. We have a mix of economy hatchbacks to sedans, SUVs, 12-seater vans, and furniture trucks, providing quality car rental Taupo-wide. Please watch our website as we add a new class of Hybrid cars. We also have car seats for hire, vehicles with towbars, and can add bike racks and ski racks for the winter season. We can arrange after-hours pick-ups and returns. We’ll provide a pick-up service from the bus station or motels with your Taupo car hire""","4.7
(142) · Car rental agency"
