,Name,Rating,Reviews,Category,Location,Contact Number,Website,Description,Meta
73,New Zealand Rent A Car Greymouth - Cheap Van Rentals,4.3,7,Car rental agency,"Greymouth, New Zealand",+64 3 768 0379,https://www.nzrentacar.co.nz/locations/greymouth/,"""Our Greymouth car hire branch is part of the nationwide New Zealand Rent A Car network, offering affordable West Coast car rental options from our handy central location in Greymouth. Our company offers you the unique convenience of nationwide coverage, combined with the personal service of independent owner-operators.

Situated on Tainui Street, close to the town centre, NZ Rent A Car Greymouth’s location is great for easy access to accommodation, shopping, restaurants, the KiwiRail TranzAlpine railway station and the town’s local attractions.""","4.3
(7) · Car rental agency"
74,Hertz Car Rental Queenstown Airport,3.8,109,Car rental agency,"Queenstown, New Zealand",+64 3 442 4106,https://www.hertz.co.nz/p/car-rentals/new-zealand/queenstown/queenstown-airport?utm_source=google&utm_medium=local&utm_campaign=gmb_listing&utm_content=queenstown%20airport,N/A,"3.8
(109) · Car rental agency"
75,RaD Car Hire New Plymouth,4.7,46,Car rental agency,"New Plymouth, New Zealand",+64 6 757 5362,https://www.radcarhire.co.nz/branches/car-rental-new-plymouth?utm_source=google+&utm_medium=organic&utm_campaign=gmb&utm_content=new-plymouth,"""RaD Car Hire New Plymouth offers a great variety of vehicles - cars, vans, people movers, and trucks all for great exceptional value. Short-term & long-term New Plymouth car rental rates available. We are locally owned and operated. James and Trevor have been co-owners of RaD car rental New Plymouth since 2002. Choose from our great selection of late-model vehicles. We also have mini-buses for the sports clubs, schools and for group outings around the New Plymouth district and a great selection of commercial hire cars. We're here to help make your trip a pleasant and stress-free one, so if you have any questions please feel free to contact us.""","4.7
(46) · Car rental agency"
76,Bargain Rental Cars - Christchurch,4.2,95,Car rental agency,"Christchurch, New Zealand",+64 3 358 9342,https://www.bargainrentalcars.co.nz/,"""When you rent a vehicle from Bargain Rental Cars - Christchurch, you are supporting a family business 100% New Zealand owned and operated for over 20 years.

You will always be provided with a personal service that ensures you get a rental vehicle that is not only a pleasure to drive, but gives you value for money.

Services we provide: Car rental, van rental, minivan rental & people mover rental

If you are looking for a car rental agency in Christchurch, look no further. Bargain Rental Cars has the friendliest service in town and maybe the best prices too.

Call us today on 03-358 9342 or book online

Remember, for cheap and reliable rental cars in Christchurch, think Bargain Rental Cars""","4.2
(95) · Car rental agency"
77,New Plymouth Airport Rental Cars,4.9,162,Car rental agency,"New Plymouth, New Zealand",+64 6 242 1110,http://newplymouthairportrentalcars.co.nz/,N/A,"4.9
(162) · Car rental agency"
78,RaD Car Hire Napier,4.9,107,Car rental agency,"Napier, New Zealand",+64 6 834 0688,http://www.radcarhire.co.nz/branches/napier,"""We are a locally owned and operated family business positioned at Hawkes Bay Airport for over 15 years.
Here at RaD Car Hire Napier not only do we provide quality vehicles at an affordable price, we also add outstanding customer service for free.
Whether you require a vehicle for a day, a month or anything in-between we can tailor a hire to suit your needs.
So for your next vehicle hire whether it is for business or pleasure please give us a call 06 834 0688 or 0800 73 68 23 or visit our website and request a booking online.""","4.9
(107) · Car rental agency"
79,Europcar Auckland City,3.7,215,Car rental agency,"Auckland, New Zealand",+64 9 379 5080,https://www.europcar.co.nz/en-nz/stations/new-zealand/auckland-city?utm_campaign=AKLC01&utm_medium=organic&utm_source=local,"""Welcome to Europcar Auckland car rental agency! Friendly service, new cars and competitive prices are part of our daily offer. Whether you want to rent a car for business or pleasure, whether you need a car (city, family or luxury car), a van or or a truck, Europcar has the rental vehicle for you. Car and van rental is simplified with Europcar’s online booking on our website or app. Collecting and dropping off your vehicle has never been easier. Enjoy your ride!""","3.7
(215) · Car rental agency"
80,Hertz Car Rental Auckland Airport,3.5,285,Car rental agency,"Auckland, New Zealand",+64 9 256 8692,https://www.hertz.co.nz/p/car-rentals/new-zealand/auckland/auckland-airport?utm_source=google&utm_medium=local&utm_campaign=gmb_listing&utm_content=auckland%20airport,N/A,"3.5
(285) · Car rental agency"
81,Budget Car & Truck Rental Hamilton City,4.2,19,Car rental agency,"Hamilton, New Zealand",+64 7 838 3585,https://www.budget.co.nz/en/locations/nz/hamilton-ni/hl1?utm_source=gmb&utm_medium=organic&utm_campaign=hamilton-downtown,"""Explore the diverse range of cheap car and truck hire vehicles at our Hamilton City branch with Budget. Whether navigating the bustling city or embarking on a holiday, secure the best car, van, and truck hire deals at Budget Car and Truck hire in Hamilton. With over 40 car hire locations in New Zealand, Budget ensures you're Good to Go. Choose Budget Car Rentals for a seamless and affordable experience, perfect for those seeking reliable and budget-friendly car rentals in Hamilton.""","4.2
(19) · Car rental agency"
82,Enterprise Rent-A-Car - Wellington Airport,4.0,92,Car rental agency,"Wellington, New Zealand",+64 9 870 3330,https://www.enterpriserentacar.co.nz/en/car-rental/locations/new-zealand/wellington-international-airport-kze3.html?mcid=yext:245709&utm_source=google&utm_medium=organic&utm_campaign=local&utm_id=WLGT,"""Enterprise Rent-A-Car in Wellington Airport is one of eight Enterprise Rent-A-Car branches in New Zealand. And is part of a network of over 9,500 branches and 90 countries worldwide. Join the largest network of rental cars, with vehicles across multiple ranges, including: SUVs, hybrids and trucks. All at an affordable price. We offer one-way rentals, where you can pick up your car in one location and drop it off at another Enterprise Rent-A-Car New Zealand branch. As well as business rentals. Our customer service team is happy to answer any of your questions. We hope to see you soon.""","4.0
(92) · Car rental agency"
83,Ace Rental Cars Auckland Airport Car Hire,4.0,284,Car rental agency,"Auckland, New Zealand",+64 800 502 277,https://www.acerentalcars.co.nz/locations/auckland-airport/?utm_source=google&utm_medium=local&utm_campaign=gmb_listing&utm_content=auckland_airport,"""We are an established deep-value car rental company and have been around for 30 years. Founded in 1987 in Auckland, New Zealand, we identified the consumer need for a budget-focused rental car company.

We now operate seventeen branches across fifteen cities throughout Australia and New Zealand. In addition to the core fleet of older vehicles, the company also provides a Premium fleet, featuring brand new vehicles with creature comforts at an attractive price.

We stick to our mission of providing the best value in rentals in Australia and New Zealand
Our focus on simplicity is underpinned by our values: friendly, confident, reliable, and straightforward.

We’re straight-talking and down to earth, so book your next rental car with us.""","4.0
(284) · Car rental agency"
84,Auckland Vehicle Rentals - Truck & Van Hire Auckland,4.7,146,Car rental agency,"Auckland, New Zealand",+64 9 827 7620,https://aucklandvehiclerentals.co.nz/?utm_source=google&utm_medium=organic&utm_campaign=gmb_newlynn,"""Auckland Vehicle Rentals specialise in having the right rental vehicle at the right price.
And we have almost 20 years’ experience doing exactly that, serving our local markets of West Auckland and North Shore City, as well as offering deliveries to Auckland airport, central city accommodation, and ferry and cruise ship terminals.
Our range of vehicles is continuously growing: cars from late model SUVs to Cheap & Cheerful runabouts, passenger vans up to 12 seats, and a variety of commercial vans and light trucks – all driveable on a standard car licence. We genuinely believe we have the right vehicle for almost every need!""","4.7
(146) · Car rental agency"
85,SIXT Rent a Car,4.1,73,Car rental agency,"Wellington, New Zealand",+64 4 555 0523,https://www.sixt.nz/car-hire/new-zealand/wellington/wellington-airport/?xaid=9141&c1=NZ&c2=wellington&c3=wellington-airport&fir=1&utm_source=google_business&utm_medium=organic,"""Welcome to SIXT Rent a Car – Wellington Airport, the premier provider of luxury car rental services. With a long-standing history of providing flexible vehicle solutions and an inspiring customer experience, SIXT stands out from its competitors. Our competitive rates for short-term or monthly car rentals and cutting-edge technology make us a one-stop shop for mobility. Discover New Zealand's stunning beauty and take a road trip from Wellington to the Coromandel Peninsula - a stunning landscape of beaches and lush forests. Out of hours pick up: Pick-up out of opening hours is possible for an additional charge. This service is bookable on request. Please provide your flight number, e-mail address and mobile number. Out of hours return: Out...""","4.1
(73) · Car rental agency"
86,Apex Car Rentals Auckland City,3.7,207,Car rental agency,"Auckland, New Zealand",+64 9 307 1063,https://www.apexrentals.co.nz/rental-car-locations/auckland-city-branch,N/A,"3.7
(207) · Car rental agency"
87,Hertz Car Rental Picton Ferry Terminal,4.4,46,Car rental agency,"Picton, New Zealand",+64 3 520 3044,https://www.hertz.co.nz/p/car-rentals/new-zealand/picton/picton-ferry-terminal?utm_source=google&utm_medium=local&utm_campaign=gmb_listing&utm_content=picton%20ferry%20terminal,N/A,"4.4
(46) · Car rental agency"
88,RaD Car Hire Wellington,4.7,89,Car rental agency,"Wellington, New Zealand",+64 4 387 9931,https://www.radcarhire.co.nz/branches/car-rental-wellington?utm_source=google+&utm_medium=organic&utm_campaign=gmb&utm_content=wellington,"""RaD Car Hire Wellington is located just 5 minutes from Wellington Airport. We offer trusted and customer service-focused car rental Wellington-wide at cheap prices. Our Wellington rental car company can cover your every car hire need and has a vehicle suited to all lifestyles. You may just require a small hatchback for local city driving, right up to requiring a 12 seater passenger rental van to transport you and your family and friends to a special occasion, or a large station wagon as you explore the wonderful sights Wellington has to offer.""","4.7
(89) · Car rental agency"
89,Avis Car and Truck Rental Blenheim Airport,4.8,10,Car rental agency,"Blenheim, New Zealand",+64 3 572 8328,https://www.avis.co.nz/en/locations/nz/blenheim/bhe?utm_source=gmb&utm_medium=organic&utm_campaign=blenheim-airport,"""Welcome to Avis at Blenheim Airport, your go-to for car rental in Blenheim, New Zealand. Explore our diverse range of new hire vehicles designed for every traveller. From compact and midsize cars for city tours to luxurious models offering comfort and style, and spacious SUVs or 4WDs perfect for family getaways. Avis also provides a full fleet of utes, vans, and moving trucks for any need. Choose Avis for exceptional service and a variety of vehicles, ensuring a great travel experience at every turn.""","4.8
(10) · Car rental agency"
90,Pegasus Car Rentals Nelson,4.7,93,Car rental agency,"Nelson, New Zealand",+64 3 539 4949,https://www.rentalcars.co.nz/pegasus-locations/nelson/,"""Pegasus Rental Cars Nelson is locally owned and operated, providing legendary service and the friendliest of welcomes! Sarah and the team can assist with all your car rental needs and give great advice on the best things to see and do in Nelson. Pegasus also has the best car rental rates in town, so why would you rent anywhere else?""","4.7
(93) · Car rental agency"
91,Budget Car & Truck Rental Auckland City,3.5,70,Car rental agency,"Auckland, New Zealand",+64 9 976 2270,https://www.budget.co.nz/en/locations/nz/auckland-ni/ak3?utm_source=GMB&utm_medium=organic&utm_campaign=Auckland-Downtown,"""Explore the diverse range of cheap car and truck hire vehicles at our Auckland City branch with Budget. Whether navigating the bustling city or embarking on a holiday, secure the best car, van, and truck hire deals at Budget Car and Truck hire in Auckland. With over 40 car hire locations in New Zealand, Budget ensures you're Good to Go. Choose Budget Car Rentals for a seamless and affordable experience, perfect for those seeking reliable and budget-friendly car rentals in Auckland.""","3.5
(70) · Car rental agency"
92,Apex Car Rentals Christchurch Airport,4.0,604,Car rental agency,"Christchurch, New Zealand",+64 3 357 4536,https://www.apexrentals.co.nz/rental-car-locations/christchurch-airport-branch,"""Choose Apex Car Rentals Christchurch Airport for your next car hire and discover why our customers rate us the best car hire company in New Zealand. Apex consistently receives 5-stars for the booking process, transperancy of costs and fees, vehicle availablity, value for money, customer service and overall satisfaction.""","4.0
(604) · Car rental agency"
93,Hertz Car Rental Auckland Northshore,3.9,38,Car rental agency,"Auckland, New Zealand",+64 9 418 3742,https://www.hertz.co.nz/p/car-rentals/new-zealand/auckland-northshore/auckland-northshore?utm_source=google&utm_medium=local&utm_campaign=gmb_listing&utm_content=auckland%20northshore,N/A,"3.9
(38) · Car rental agency"
94,NZ Discount Car Rentals,3.4,156,Car rental agency,"Auckland, New Zealand",+64 800 179 5179,http://www.nzdcr.co.nz/,N/A,"3.4
(156) · Car rental agency"
95,Apex Car Rentals Nelson Airport,4.3,124,Car rental agency,"Nelson, New Zealand",+64 3 547 6800,https://www.apexrentals.co.nz/rental-car-locations/nelson-airport-branch,"""Apex Car Rentals Nelson Airport is located 2 minutes from the terminal building and we provide a free shuttle service to our location.

Book online and choose from a wide selection of rental vehicles including small economy cars, mid-sized and full sized sedans, station wagons, 4WD's, and people movers.

We pride ourselves on delivering exceptional service and respecting the cultural diversity of our customers.

Try Apex Nelson Airport for your next car hire and discover why our customers rate us the best car rental company in New Zealand.""","4.3
(124) · Car rental agency"
96,Ezi Car Rental - Christchurch City,4.4,17,Car rental agency,"Christchurch, New Zealand",+64 800 545 000,http://www.ezicarrental.co.nz/,"""Established in 1998, we are one of New Zealand’s largest rental car operators, with over 25 years’ experience in the New Zealand rental car industry.
We are a team of over 200 passionate individuals, across 24 convenient locations nationwide. Our aim is to provide the greatest rental experience possible across Aotearoa, and to make it ezi!""","4.4
(17) · Car rental agency"
97,SIXT Car Rental Christchurch Airport,4.0,107,Car rental agency,"Christchurch, New Zealand",+64 800 237 637,https://www.sixt.nz/car-hire/new-zealand/christchurch/christchurch-airport/?xaid=9141&c1=NZ&c2=christchurch&c3=christchurch-airport&fir=1&utm_source=google_business&utm_medium=organic,"""Welcome to SIXT Car Rental Christchurch Airport. Conveniently located in-terminal at Christchurch Airport we offer a wide range of flexible vehicle solutions to cater to your ever-changing mobility needs. Look for our bright orange sign just past Baggage Claim or visit our Sixt NZ website to check out the largest range of premium and luxury rentals on offer in New Zealand.

We are the only rental car company in New Zealand to feature such a large range of trusted premium, luxury and budget friendly vehicles. The majority of our fleet are less than 6 months old and our core range consists of Audi, Skoda, Cupra, Polestar, Range Rover, Toyota & Volkswagen vehicles.""","4.0
(107) · Car rental agency"
98,EZU Car Rental,3.9,185,Car rental agency,"Auckland, New Zealand",+64 22 182 5752,http://www.ezucarrental.com/,N/A,"3.9
(185) · Car rental agency"
99,Europcar Napier Airport,4.6,27,Car rental agency,"Napier, New Zealand",+64 6 835 8818,https://www.europcar.co.nz/en-nz/stations/new-zealand/napier-airport?utm_campaign=NPET01&utm_medium=organic&utm_source=local,"""Pickup and drop off is available outside of normal business hours by prior arrangement.* Europcar Napier car rental agency, friendly service, new cars and competitive prices are part of our daily offer. Whether you want to rent a car for business or pleasure, whether you need a car (city, family or luxury car), a van or a truck, Europcar has the rental vehicle for you. Car and van rental is simplified with Europcar’s online booking on our website or app. Collecting and dropping off your vehicle has never been easier. Enjoy your ride!*Additional ""after hours"" fees may apply.""","4.6
(27) · Car rental agency"
100,Bargain Rental Cars - Mt Wellington,4.6,54,Car rental agency,"Auckland, New Zealand",+64 9 280 4069,https://www.bargainrentalcars.co.nz/,"""When you rent a vehicle from Bargain Rental Cars - Mt Wellington, you are supporting a family business 100% New Zealand owned and operated for over 20 years.

You will always be provided with a personal service that ensures you get a rental vehicle that is not only a pleasure to drive, but gives you value for money.

Services we provide: Car rental, van rental, minivan rental & people mover rental

If you are looking for a car rental agency in Mt Wellington and surround areas, look no further. Bargain Rental Cars has the friendliest service in town and maybe the best prices too.

Call us today on 09-280 4069 or book online

Remember, for cheap and reliable rental cars in Mt Wellington, think Bargain Rental Cars""","4.6
(54) · Car rental agency"
101,New Zealand Discount Car Rentals,3.9,49,Car rental agency,"Christchurch, New Zealand",+64 3 974 3818,http://www.nzdcr.co.nz/,N/A,"3.9
(49) · Car rental agency"
102,RentAClassic Nelson,4.8,20,Car rental agency,Closed ⋅ Opens 8 am · +64 210 747 105,N/A,http://www.rentaclassic.co.nz/,"""Drive superb sports and convertible cars on some of the most scenic and exciting roads in the world.

Classics from MG and Alfa Romeo, modern sporting Minis and Mercedes, sonorous V8s from Jaguar and Lexus. All hires come with unlimited kms and a personal handover to ensure you're more than comfortable. Automatics and manuals, 2 or 4 seaters, we've got something for every price range, and our customer testimonials are second to none.

Cars available from our Nelson and Christchurch bases, just 10 minutes from the airports.

Elegance, character, luxury, fun.....Drive Something Different with RentAClassic!""","4.8
(20) · Car rental agency"
103,Great Rentals LTD Car Rental,4.0,68,Car rental agency,"Auckland, New Zealand",+64 9 580 0588,N/A,N/A,"4.0
(68) · Car rental agency"
104,Avis Car and Truck Rental Wellington City,3.9,45,Car rental agency,"Wellington, New Zealand",+64 4 801 8108,https://www.avis.co.nz/en/locations/nz/wellington/wl3?utm_source=gmb&utm_medium=organic&utm_campaign=wellington-downtown,"""Discover the range of car rentals available in Wellington City with Avis. Our Wellington City branch offers small and medium cars for a busy day in city, luxurious premium models for the corporate traveller and SUVs or 4WDs that would make the perfect accompaniment for a family holiday. Plus Avis also offers electric car rentals, and a full range of utes, vans, and moving trucks for various commercial needs. Choose Avis for great service and best value truck and car hire in Wellington City.""","3.9
(45) · Car rental agency"
105,Hertz Car Rental Christchurch Airport,3.7,140,Car rental agency,"Christchurch, New Zealand",+64 3 358 6730,https://www.hertz.co.nz/p/car-rentals/new-zealand/christchurch/christchurch-airport?utm_source=google&utm_medium=local&utm_campaign=gmb_listing&utm_content=christchurch%20airport,N/A,"3.7
(140) · Car rental agency"
106,Top Rental,4.7,62,Car rental agency,"Auckland, New Zealand",+64 800 668 628,https://www.toprental.co.nz/,N/A,"4.7
(62) · Car rental agency"
107,Europcar Wellington Ferry Station,3.7,100,Car rental agency,"Wellington, New Zealand",+64 4 473 0480,https://www.europcar.co.nz/en-nz/stations/new-zealand/wellington-ferry-terminal?utm_campaign=WLGP01&utm_medium=organic&utm_source=local,"""Welcome to Europcar Wellington car rental agency! Friendly service, new cars and competitive prices are part of our daily offer. Whether you want to rent a car for business or pleasure, whether you need a car (city, family or luxury car), a van or or a truck, Europcar has the rental vehicle for you. Car and van rental is simplified with Europcar’s online booking on our website or app. Collecting and dropping off your vehicle has never been easier. Enjoy your ride!""","3.7
(100) · Car rental agency"
108,ACE Rent A Car,4.0,30,Car rental agency,"Picton, New Zealand",+64 800 502 277,https://www.acerentalcars.co.nz/,N/A,"4.0
(30) · Car rental agency"
109,Abell Rentals,4.4,135,Car rental agency,"Christchurch, New Zealand",+64 3 358 9342,https://www.abell.co.nz/,"""Abell Rentals is a well established, privately owned and operated nationwide business. Specialising in trailer and vehicle hire and leasing packages to suit your needs from long or short term, one day to one year. We also offer one way hires between our nationwide rental locations. With a well maintained fleet of vehicles and trailers, we use only New Zealand designed and built Briford trailers that have been proven in the rental industry. From moving vans and trucks to minivans and minibus hire - we do it all, and at a competitive price!""","4.4
(135) · Car rental agency"
110,Bargain Rental Cars - East Tamaki,4.7,30,Car rental agency,"Auckland, New Zealand",+64 9 282 0918,https://www.bargainrentalcars.co.nz/,"""When you rent a car from Bargain Rental Cars in East Tamaki, you are supporting a family business 100% New Zealand owned and operated for over 20 years.

You will always be provided with a personal service that ensures you get a rental vehicle that is not only a pleasure to drive, but gives you value for money.

Services we provide: Car rental, van rental, minivan rental & people mover rental

If you are looking for a car rental agency in East Tamaki or in South Auckland, look no further. Bargain Rental Cars has the friendliest service in town and maybe the best prices too.

Call us today on 09-282 0918 or book online

Remember, for cheap and reliable rental cars in East Tamaki, think Bargain Rental Cars""","4.7
(30) · Car rental agency"
111,Nelson Car Hire,4.6,57,Car rental agency,"Nelson, New Zealand",+64 800 283 545,https://www.nelsoncarhire.co.nz/,N/A,"4.6
(57) · Car rental agency"
112,Mode Rentals,3.9,96,Car rental agency,"Auckland, New Zealand",+64 9 373 3925,https://www.moderentals.co.nz/,"""Mode Rentals Auckland is a Kiwi owned, independent car rental company offering reliable vehicles for hire. Located in Auckland CBD, our rental fleet includes economical and compact cars, SUVs, 8-seater people movers, and 10 and 12-seater vans. Enjoy Kiwi hospitality during normal hours and with a small after-hours fee for early or late arrivals. Extra items such as baby car seats, infant capsules or GPS can be hired, but our staff will share our local knowledge and enthusiasm about New Zealand for free. We offer drop-off options at any of our branches across New Zealand. Whatever your vehicle needs, visiting family or friends, road trip, function or business travel, we’d be honoured to help you find your mode.""","3.9
(96) · Car rental agency"
113,"Rite Price Rentals (Tauranga Airport) - Car, Van & Truck Rentals",4.7,62,Car rental agency,"Mount Maunganui, New Zealand",+64 7 575 2726,https://www.ritepricerentals.co.nz/,"""Affordable & Reliable Rental Vehicles at Tauranga Airport! Book your rental car or van in Tauranga from one of our two friendly and convenient branches (Tauranga City & Airport). Our Airport branch includes pickup from the car rental booth in terminal to get you on the way!

Rite Price Rentals offers a wide variety of rental cars and vans to suit every budget. The Team and Rite Price Rentals will always go the extra mile to ensure you have the best possible experience.""""","4.7
(62) · Car rental agency"
114,Apex Car Rentals Greymouth Railway Station,4.4,28,Car rental agency,"Greymouth, New Zealand",+64 3 768 0785,https://www.apexrentals.co.nz/rental-car-locations/greymouth-railway-station-branch,"""Apex Car Rentals Greymouth Railway Station is located inside the station building in central Greymouth.

Book online and choose from a wide selection of rental vehicles including small economy cars, mid-sized and full sized sedans, station wagons, 4WD's, and people movers.

We pride ourselves on delivering exceptional service and respecting the cultural diversity of our customers.

Try Apex Greymouth Railway Station for your next car hire and discover why our customers rate us the best car rental company in New Zealand.""","4.4
(28) · Car rental agency"
115,Darn Cheap Rentals,4.5,65,Car rental agency,"Lower Hutt, New Zealand",+64 800 800 327,http://www.dcrentals.co.nz/,N/A,"4.5
(65) · Car rental agency"
116,Hertz Car Rental Napier Airport,4.4,20,Car rental agency,"Napier, New Zealand",+64 6 835 6169,https://www.hertz.co.nz/p/car-rentals/new-zealand/napier/napier-airport?utm_source=google&utm_medium=local&utm_campaign=gmb_listing&utm_content=napier%20airport,N/A,"4.4
(20) · Car rental agency"
